;http://www.hcdmza.gov.ar/proy/viewer.php?nro=29727;29727;AHUMADA,ARTURO;CASTANOS   ;QUE LA SUPREMA CORTE DE JUSTICIA DISPUSIERA LA SUSPENSION POR 30 DIAS DE LOS PROCESOS INICIADOS POR DEMANDAS DE EJECUCIOHIPOTECARIA DE VIVIENDA UNICA, PRENDARIAS Y PERSONALES;CD;D ;PJ;29/01/2002
;http://www.hcdmza.gov.ar/proy/viewer.php?nro=29739;29739;AHUMADA,ARTURO;   ;SOLICITANDO AL PE INCLUYA EN EL PRESUPUESTO 2002 LAS PARTIDAS PRESUPUESTARIAS QUE GARANTICEN LOS FONDOS LIQUIDOS PARAEL DESARROLLO DEL PASIP;CD;R ;PJ;29/01/2002
;http://www.hcdmza.gov.ar/proy/viewer.php?nro=29746;29746;AHUMADA,ARTURO;   ;INVITANDO AL GERENTE ZONAL DE TELEFONICA A LA COMISION DEDGCPP A FIN DE INFORMAR SOBRE METODOLOGIA DE TRABAJO DE LA EEMPRESA;CD;R ;PJ;30/01/2002
;http://www.hcdmza.gov.ar/proy/viewer.php?nro=29816;29816;AHUMADA,ARTURO;BRUNI   ;SOLICITANDO PE DE CUMPLIMIENTO AL PAGO DE LA TOTALIDAD DELAS DEUDAS CON LOS MUNICIPIOS POR COPARTICIPACION NOCUMPLIMENTADA ALA FECHA DE LA SANCION DE LOS PETROM;CD;R ;PJ;12/02/2002
;http://www.hcdmza.gov.ar/proy/viewer.php?nro=29883;29883;AHUMADA,ARTURO;SERRALTA   ;INVITANDO MIN.HAC.; SUBSEC.HAC. Y SUBSEC.FIN. A COMISION DEH.P. A FIN DE INFORMAR SOBRE RECAUDACION DE IMPUESTOSPROVINCIALES DESDE 01-01-02 A LA FECHA;CD;R ;PJ;26/02/2002
;http://www.hcdmza.gov.ar/proy/viewer.php?nro=29907;29907;AHUMADA,ARTURO;SERRALTA   ;DISTINGUIENDO A EFECTIVOS DE LA POLICIA DE MZA. UNIDAD MOTORIZADA DE MAIPU POR EL CORRECTO ACCIONAR CON EL INTENDENTE DE TUPUNGATO;CD;R ;PJ;01/03/2002
;http://www.hcdmza.gov.ar/proy/viewer.php?nro=29908;29908;AHUMADA,ARTURO;   ;FACULTANDO A LA ADMINIST. DEL FONDO PARA LA TRANSFORMACION YCRECIM. A SUSCRIBIR CON ORGANISMOS E INSTITUCIONES FINANCIERCONTRATO DE FIDEICOMISO PRODUCTIVO PARA LA COSECHA Y ACARREO;CD;L ;PJ;01/03/2002
;http://www.hcdmza.gov.ar/proy/viewer.php?nro=29915;29915;AHUMADA,ARTURO;CORTIZO SERRALTA CORDOBA ;REFORMANDO LA COMPOSICION DEL PODER LEGISLATIVO PROVINCIAL;CD;L ;PJ;04/03/2002
;http://www.hcdmza.gov.ar/proy/viewer.php?nro=29932;29932;AHUMADA,ARTURO;CORTIZO   ;INCORPORANDO EL ART. 5 A LA LEY 6545 -RECURSOS PARTICIPABLESA MUNICIPIOS-;CD;L ;PJ;06/03/2002
;http://www.hcdmza.gov.ar/proy/viewer.php?nro=29951;29951;AHUMADA,ARTURO;   ;SOLICITANDO PE INFORME SOBRE LA MODIFICACION DEL PADRON DEREGANTES;CD;R ;PJ;12/03/2002
;http://www.hcdmza.gov.ar/proy/viewer.php?nro=29966;29966;AHUMADA,ARTURO;CORTIZO   ;INVITANDO O.P.I. AL PTE. TELEFONICA Y DELEGADO C.N.C., A FINDE QUE INFORMEN SOBRE ASPECOTS DEL SERVICIO TELEFONICO QUESE PRESTA A LA PROVINCIA DE MENDOZA;CD;R ;PJ;13/03/2002
;http://www.hcdmza.gov.ar/proy/viewer.php?nro=30058;30058;AHUMADA,ARTURO;SERRALTA   ;GIRANDO ARCHIVO LAS ACTUACIONES OBRANTE EN EXPTE. 27077 -PROYECTO DE LEY ETICA PERIODISTICA-;CD;R ;PJ;26/03/2002
;http://www.hcdmza.gov.ar/proy/viewer.php?nro=30099;30099;AHUMADA,ARTURO;ABRILE   ;CREANDO LA AUDITORIA GRAL DE LA PROVINCIA DE MZA., UNIDAD DECONTROL EXTERNO CONCOMITANTE DEL SECTOR PUBLICO PCIAL. Y DEPENDIENTE DE LA H LEGISLATURA PCIAL.;CD;L ;PJ;04/04/2002
;http://www.hcdmza.gov.ar/proy/viewer.php?nro=30100;30100;AHUMADA,ARTURO;   ;SOLICITANDO AL MINSITERIO DE HACIENDA INFORME SI LA PCIA. HAINCURRIDO EN MORA EN EL PAGO DE CAPITAL E INTERESES DE LOSVENCIMIENTOS DEL BONO DE CONSOLIDACION DE OBLIGAC. PCIALES.;CD;R ;PJ;04/04/2002
;http://www.hcdmza.gov.ar/proy/viewer.php?nro=30101;30101;AHUMADA,ARTURO;   ;SOLICITANDO A LEGISL.NAC. POR MZA. GESTIONEN LA LIBERACIONDE LOS DEPOSITOS DEL "CORRALITO" CUANDO SEAN UTILIZADOS ENCONSTRUCCIONES, AMPLIACIONES, PROY. DE INGENIERIA Y ARQUITEC;CD;R ;PJ;04/04/2002
;http://www.hcdmza.gov.ar/proy/viewer.php?nro=30105;30105;AHUMADA,ARTURO;SERRALTA CORTIZO DOMINGUEZ ;REGULANDO EL ORDENAMIENTO TERRITORIAL Y AMBIENTAL DENTRO DELA POLIGONAL DE EXPROPIACION SEGUN LEY 6498 Y EN EL ESPEJO DE AGUA DE POTRERILLOS EN SU USO RECREATIVO,TURIST. Y DEPORT. (PERILAGO);CD;L ;PJ;05/04/2002
;http://www.hcdmza.gov.ar/proy/viewer.php?nro=30170;30170;AHUMADA,ARTURO;   ;SOLICITANDO A LEGISLADORES NACIONALES POR MENDOZA GESTIONELA NO APLICACION DEL C.E.R.;CD;R ;PJ;16/04/2002
;http://www.hcdmza.gov.ar/proy/viewer.php?nro=30178;30178;AHUMADA,ARTURO;SERRALTA   ;CITANDO AL MINIST. DE HACIENDA A INFORMAR SOBRE LOS FONDOSPROVEN. DEL RUBRO RECURSOS ESPECIF. ASIGNADOS, CORRESP. A LACOPART. FED. Y REMITIDOS A MZA. DESDE 1-1-01 A 15-4-02;CD;R ;PJ;17/04/2002
;http://www.hcdmza.gov.ar/proy/viewer.php?nro=30193;30193;AHUMADA,ARTURO;CORTIZO CORDOBA  ;SOLICITANDO AL PE QUE INSTRUMENTE EL APGO DE LOS SUELDOS DELOS EMPLEADOS PUBLICOS EN TIEMPO, FORMA Y COMPLETO;CD;R ;PJ;19/04/2002
;http://www.hcdmza.gov.ar/proy/viewer.php?nro=30401;30401;AHUMADA,ARTURO;   ;INVITANDO MIN.ECO. A COMISION DE E.E.M.I. A FIN DE QUEBRINDE DETALLE SOBRE EL INFORME PRODUCIDO POR MIN.ECO. DE LARES. 561/02 -DEUDA BODEGA GIOL CON COOP. LA DORMIDA LTDA-;CD;R ;PJ;21/05/2002
;http://www.hcdmza.gov.ar/proy/viewer.php?nro=30443;30443;AHUMADA,ARTURO;MORON PUGA SERRALTA PARISI;FACULTANDO A LA COMISION DE AMBIENTE, URB, Y VIVIENDA A CONSTITUIRSE COMO COMISION INVESTIGADORA SOBRE LAS PRESUNTAS IRREGULARIDADES COMETIDAS POR EL I.P.V.;CD;R ;PJ;28/05/2002
;http://www.hcdmza.gov.ar/proy/viewer.php?nro=30470;30470;AHUMADA,ARTURO;   ;QUE LEG.NAC. REALICEN LAS ACCIONES PARA QUE SOLO PERSONAS DEEXISTENCIA VISIBLE Y CON RESIDENCIA PERMANENTE EN EL PAIS,PODRAN SER DUENOS DE MEDIOS DE COMUNICACION;CD;D ;PJ;29/05/2002
;http://www.hcdmza.gov.ar/proy/viewer.php?nro=30541;30541;AHUMADA,ARTURO;URIGUEN SERRALTA  ;CREANDO EL FIDEICOMISO REGIONAL DE INVERSIONES PRODUCTIVAS(FRIP) EN LOS TERMINOS Y CON LOS ALCANCES DE LA LEY 24.441PARA FINANCIAR PROYECTOS DE INVERS. PRIVAD.;CD;L ;PJ;06/06/2002
;http://www.hcdmza.gov.ar/proy/viewer.php?nro=30611;30611;AHUMADA,ARTURO;SERRALTA CIURCA  ;SOLICITANDO MIN.JUS.SEG. INFORME SOBRE LOS ORIGENES DE LOSACTOS DENOMINADOS "SAQUEOS" PRODUCIDOS EN EL DEPTO. LAVALLE;CD;R ;PJ;18/06/2002
;http://www.hcdmza.gov.ar/proy/viewer.php?nro=30648;30648;AHUMADA,ARTURO;SERRALTA   ;ESTABLECIENDO EN LA PROVINCIA EL REGIMEN DE SELECCION DECANDIDATOS A CARGOS PUBLICOS ELECTIVOS MEDIANTE ELECCIONESINTERNAS ABIERTAS;CD;L ;PJ;24/06/2002
;http://www.hcdmza.gov.ar/proy/viewer.php?nro=30678;30678;AHUMADA,ARTURO;SERRALTA   ;SOLICITANDO AL H. SENADO SE CONSTITUYA A FIN DE FORMAR COMISION BICAMERAL PARA DAR SOLUCIONES SOBRE LA INDUSTRIA DE LACONSTRUCCION;CD;R ;PJ;27/06/2002
;http://www.hcdmza.gov.ar/proy/viewer.php?nro=30696;30696;AHUMADA,ARTURO;SERRALTA CORDOBA  ;MODIFICANDO EL ART. 82 DE LA LEY ELECTORAL DE LA PCIA. INTRODUCIENDO AL SISTEMA ELECTORAL VIGENTE EL VOTO DE PREFERENCIA;CD;L ;PJ;01/07/2002
;http://www.hcdmza.gov.ar/proy/viewer.php?nro=30702;30702;AHUMADA,ARTURO;SERRALTA   ;INVITANDO AL MINIST. DE AMBIENTE Y OP, AL PRES. DEL IPV ALA COMISION DE OPI Y DE AUV DE AMBAS CAMARAS A FIN DE TRATAREL PETITORIO PRESENTADO POR LA CAMARA DE LA CONST. Y LA UOC;CD;R ;PJ;01/07/2002
;http://www.hcdmza.gov.ar/proy/viewer.php?nro=30769;30769;AHUMADA,ARTURO;SERRALTA   ;SOLICITANDO A LA SUBSEC. DE CULTURA INFORME SI LA SRA. ANAMARIA ALVAREZ, RATIFICA O RECTIFICA LAS EXPRESIONES VERTIDADEN EL DIARIO UNO EL 05-07-02;CD;R ;PJ;05/07/2002
;http://www.hcdmza.gov.ar/proy/viewer.php?nro=30787;30787;AHUMADA,ARTURO;GAUA   ;SOLICITANDO A LA BOLSA DE COMERCIO S.A. INFORME SOBRE VARIOSPUNTOS REFERIDOS A LA FIRMA EXPERTA BURSATIL S.A.;CD;R ;PJ;10/07/2002
;http://www.hcdmza.gov.ar/proy/viewer.php?nro=30789;30789;AHUMADA,ARTURO;GAUA   ;SOLICITANDO A LA DCCION. DE PERSONAS JURIDICAS INFORME SOBREVARIOS PUNTOS REFERIDOS A LA FIRMA EXPERTA BURSATIL S.A.;CD;R ;PJ;10/07/2002
;http://www.hcdmza.gov.ar/proy/viewer.php?nro=30788;30788;AHUMADA,ARTURO;GAUA   ;SOLICIANDO A LA COMISION NACIONAL DE VALORES INFORME SOBREVARIOS PUNTOS  REFERIDOS A LA FIRMA EXPERTA BURSATIL S.A.;CD;R ;PJ;10/07/2002
;http://www.hcdmza.gov.ar/proy/viewer.php?nro=30834;30834;AHUMADA,ARTURO;   ;SOLICITANDO AL PE Y A LEGISLADORES POR MZA. QUE ARBITREN MEDIDAS PARA PRESEVAR LAS FUENTES LABORALES;CD;R ;PJ;16/07/2002
;http://www.hcdmza.gov.ar/proy/viewer.php?nro=30996;30996;AHUMADA,ARTURO;   ;DECLARANDO INTERES H. CAMARA EL "I FESTIVAL DEL PIEDEMONTEEN LA COLONIA SUIZA", LLEVADO A CABO EN BLANCO ENCALADA;CD;R ;PJ;06/08/2002
;http://www.hcdmza.gov.ar/proy/viewer.php?nro=31039;31039;AHUMADA,ARTURO;   ;DECLARANDO INTERES H. CAMARA EL ACTO CULTURAL DEMONINADA"ENCENDIENDO VIGILIAS POR SUS SUENOS", A REALIZARSE EN ELDEPTO. LAS HERAS;CD;D ;PJ;12/08/2002
;http://www.hcdmza.gov.ar/proy/viewer.php?nro=31209;31209;AHUMADA,ARTURO;   ;SOLICITANDO D.G.IRRIGACION INFORME SOBRE LA LIQUIDACION DELOS CONTRATOS AL PERSONAL CONTRATADO PARA LAS INSPECCIONESTRAMO 5/6 DEL CANAL SAN MARTIN;CD;R ;PJ;03/09/2002
;http://www.hcdmza.gov.ar/proy/viewer.php?nro=31310;31310;AHUMADA,ARTURO;   ;SOLICITANDO AUTORIDADES DEL I.P.JUEGOS INFORME SOBRE LAPOSIBLE CONSTRUCCION Y/0 AMPLIACION DEL CASINO PROVINCIAL;CD;R ;PJ;17/09/2002
;http://www.hcdmza.gov.ar/proy/viewer.php?nro=31329;31329;AHUMADA,ARTURO;   ;ESTABLECIENDO QUE TODO RECURSO PARA EL FINANCIAMIENTO DEL SECTOR PUBLICO, DEBERA CONSIDERARSE AFECTADO A LA MASA COPARTICIPABLE A LOS MUNICIPIOS;CD;L ;PJ;18/09/2002
;http://www.hcdmza.gov.ar/proy/viewer.php?nro=31333;31333;AHUMADA,ARTURO;SERRALTA ABRILE  ;ESTABLECIENDO QUE TODO RECURSO PARA EL FINANACIAMIENTO DELSECTOR PUBLICO DEBERA CONSIDERARSE AFECTADO A LA MASA COPARTICIPABLE A LOS MUNICIPIOS;CD;L ;PJ;19/09/2002
;http://www.hcdmza.gov.ar/proy/viewer.php?nro=31362;31362;AHUMADA,ARTURO;CORDOBA   ;ESTABLECIENDO QUE LOS PRODUCTORES QUE EXPORTEN FRUTOS DE PEPITA Y CAROZO, TENDRAN DESC. DE HASTA 50% EN IMPUESTO TRIBUTARIO Y TASAS Y SERVICIOS PCIALES.;CD;L ;PJ;23/09/2002
;http://www.hcdmza.gov.ar/proy/viewer.php?nro=31363;31363;AHUMADA,ARTURO;   ;ESTABLECIENDO QUE TODOS LOS CARGOS DE LA ADMINIST. PUBLICAPCIAL., CORRESPONDIENTES A CARGOS JERARGICOS, SERAN CUBIERTOS POR PROFESIONALES CON ESTUDIOS TERCIARIOS IDONEOS;CD;L ;PJ;23/09/2002
;http://www.hcdmza.gov.ar/proy/viewer.php?nro=31360;31360;AHUMADA,ARTURO;   ;ENCOMENDANDO A LA DCCION. DE PERSONAL DE LA H. CAMARA A CREAR UN REGISTRO OBLIGATORIO EN EL QUE SE ESPECIFIQUE EL GRUPOSANGUINEO DE TODO EL PERSONAL;CD;R ;PJ;23/09/2002
;http://www.hcdmza.gov.ar/proy/viewer.php?nro=31361;31361;AHUMADA,ARTURO;   ;SOLICITANDO AL PE INFORME SOBRE EL ESTADO DE RECUPERACION DELAS INVERSIONES REALIZADAS POR LA PCIA. EN LA FINANCIERA LUJAN WILLIAMS, TENIENDO EN CUENTA LA RES. 923 DE LA H. CAMARA;CD;R ;PJ;23/09/2002
;http://www.hcdmza.gov.ar/proy/viewer.php?nro=31367;31367;AHUMADA,ARTURO;   ;SOLICITANDO AL PE INFORME SOBRE LA APLICACION DE LA LEY 6985Y LA PUBLICITADA OPERACION DE VENTA DE 140.000.000 LTS DE VINO PARA EXPORTACION Y CAUSAS DE SU NO CONCRECION;CD;R ;PJ;24/09/2002
;http://www.hcdmza.gov.ar/proy/viewer.php?nro=31377;31377;AHUMADA,ARTURO;   ;SOLICITANDO AUTORIDADES H.C.D. Y SENADORES QUE LA PUERTA DEACCESO A LA LEGISLATURA SOBRE PEATONAL SARMIENTO, PERMANEZCAABIERTA EN LOS HORARIOS DE GESTION DE AMBAS CAMARAS;CD;R ;PJ;24/09/2002
;http://www.hcdmza.gov.ar/proy/viewer.php?nro=31366;31366;AHUMADA,ARTURO;SERRALTA   ;ESTABLECIENDO QUE LA ADMINISTRAC. Y/O APLICACION DE LOS CODIGOS DE DESCUENTO AL PERSONAL DE LA ADMINIST. PUBLICA NO PODRA SER PRIVATIZADA O TERCERIZADA POR EL GOBIERNO PCIAL.;CD;L ;PJ;24/09/2002
;http://www.hcdmza.gov.ar/proy/viewer.php?nro=31488;31488;AHUMADA,ARTURO;   ;SOLICITANDO SUPREMA CORTE RECABE ANTECEDENTES RESPECTO DEJUECES QUE ESTARIAN ORDENANDO DESALOJOS Y REMATES DE DEUDORHIPOTECARIOS, ACTUALMENTE SUSPENDIDO POR LEGIS. VIGENTE;CD;R ;PJ;02/10/2002
;http://www.hcdmza.gov.ar/proy/viewer.php?nro=31568;31568;AHUMADA,ARTURO;CORDOBA   ;ESTABLECIENDO LA CANCELACION DE OBLIGACIONES DEL ESTADO PROVINCIAL POR EL PAGO DE SUMAS DE DINERO MEDIANTE LA ENTREGADE TITULOS VALOR ENDOSABLES (CERTIFIC. DE CREDITO FISCAL);CD;L ;PJ;11/10/2002
;http://www.hcdmza.gov.ar/proy/viewer.php?nro=31645;31645;AHUMADA,ARTURO;   ;SOLICITANDO A COMISION NAC.ENERGIA ATOMICA INFORME LAS RAZO-NES QUE MOTIVARON LA SUSPENSION DEL TRATAMIENTO DE LAS DENO-MINADAS "COLAS DE URANIO", DPTO. MALARGUE;CD;R ;PJ;22/10/2002
;http://www.hcdmza.gov.ar/proy/viewer.php?nro=31642;31642;AHUMADA,ARTURO;   ;QUE MIN.DES.SOC.SAL. CONCURRA A LA COMISION D.S. A FIN DEINFORMAR SOBRE LOS RESULTADOS DE LA LEY 6044 Y SU DECRETOREGLAMENTARIO;CD;R ;PJ;22/10/2002
;http://www.hcdmza.gov.ar/proy/viewer.php?nro=31671;31671;AHUMADA,ARTURO;   ;SOLICITANDO AL PE INTERTANTO EFECTIVICE LA RES. 1464/02, HAGA EFECTIVO EL PAGO DE LA PARTE CORRESPONDIENTE EN PETROM ATODA LA ADMINIST. PUBLICA ENTRE EL 30 Y EL 5 DE CADA MES;CD;R ;PJ;24/10/2002
;http://www.hcdmza.gov.ar/proy/viewer.php?nro=31812;31812;AHUMADA,ARTURO;SERRALTA PEREZ BOTTI  ;SOLICITANDO PE RESTITUYA A PARTIR DEL 01-01-2003 A TODOS LOSEMPLEADOS PUBLICOS LOS DESCUENTOS ESTABLECIDOS POR LOSDECRETOS 1448 Y 1765/01;CD;R ;PJ;05/11/2002
;http://www.hcdmza.gov.ar/proy/viewer.php?nro=31899;31899;AHUMADA,ARTURO;SERRALTA SORON MONTANO ;ESTABLECIENDO QUE EL PE DEBERA REUNIR TODA LA INFORMACIONACERCA DE LA LIQUIDACION DE REGALIAS PETROLIFERAS Y EL INICIO DE ACCIONES DE RECLAMO A LA NACION;CD;L ;PJ;15/11/2002
;http://www.hcdmza.gov.ar/proy/viewer.php?nro=31905;31905;AHUMADA,ARTURO;   ;QUE EL PE DECLARARA DE INTERES PCIAL. LA "PRIMERA JORNADAAMBIENTALISTA DEL DEPARTAMENTO LAS HERAS";CD;D ;PJ;18/11/2002
;http://www.hcdmza.gov.ar/proy/viewer.php?nro=31904;31904;AHUMADA,ARTURO;   ;DECLARANDO DE INTERES DE LA H. CAMARA LA "PRIMERA JORNADAAMBIENTALISTA DEL DPTO. LAS HERAS";CD;R ;PJ;18/11/2002
;http://www.hcdmza.gov.ar/proy/viewer.php?nro=32011;32011;AHUMADA,ARTURO;   ;CITANDO AL MINIST. DE ECONOMIA Y A LA SUBSECRET. DE TRABAJOA FIN DE QUE INFORMEN SOBRE EMPRESAS CEMENTERAS;CD;R ;PJ;02/12/2002
;http://www.hcdmza.gov.ar/proy/viewer.php?nro=32142;32142;AHUMADA,ARTURO;   ;SOLICITANDO AL PE INFORME SOBRE EL ESTADO DE LAS ACREENCIASQUE LA PROV. TIENE SOBRE LA FINANCIERA LUJAN WILLIAMS;CD;R ;PJ;13/12/2002
;http://www.hcdmza.gov.ar/proy/viewer.php?nro=32140;32140;AHUMADA,ARTURO;   ;ESTABLECIENDO QUE LAS DIFERENCIAS EN MAS DE PRECIO POR BARRIL WIT SERAN DESTINADAS MENSUALMENTE A UN FONDO FIDUCIARIO PARA CRECIMIENTO DE MICROEMPRENDIMIENTOS Y CAPACITACION;CD;L ;PJ;13/12/2002
;http://www.hcdmza.gov.ar/proy/viewer.php?nro=32143;32143;AHUMADA,ARTURO;   ;SOLICITANDO AL PE QUE INFORME SOBRE EL CRONOGRAMA DE INVERSIONES A DESARROLLAR EN EL PARQUE DE SERVICIOS E INDUSTRIASPALMIAR (PASIP);CD;R ;PJ;13/12/2002
;http://www.hcdmza.gov.ar/proy/viewer.php?nro=32144;32144;AHUMADA,ARTURO;   ;ESTABLECIENDO QUE EL PE DEBERA REMITIR MENSUALMENTE UN RESUMEN DE LAS DEUDAS CONSOLIDADAS Y NO CONSOL. DE LA ADMIN. CENTRAL Y ORGANISMOS DE LA ADM. DESCENTRALIZADA;CD;L ;PJ;13/12/2002
;http://www.hcdmza.gov.ar/proy/viewer.php?nro=32153;32153;AHUMADA,ARTURO;MORON   ;SOLICITANDO AL FISCAL DE ESTADO EL LISTADO DE TODAS LAS DEMANDAS QUE SE LE HAN INICIADO A LA PCIA. A TRAVES DE LA ADMINIST. CENTRAL Y/O ORGANISMOS DESCENTRALIZADOS;CD;R ;PJ;16/12/2002
;http://www.hcdmza.gov.ar/proy/viewer.php?nro=32154;32154;AHUMADA,ARTURO;MORON   ;SOLICITANDO AL PE QUE INFORME SOBRE LAS DEUDAS QUE AFECTANAL ERARIO PCIAL. INDICANDO MONTOS DE CAPITAL Y O INTERESESY O SERVICIOS ANUALES DE INTERESES;CD;R ;PJ;16/12/2002
;http://www.hcdmza.gov.ar/proy/viewer.php?nro=32343;32343;AHUMADA,ARTURO;   ;CREANDO EN EL MARCO DEL IPV EL REGISTRO DE VIVIENDA PARA VETERANOS DE GUERRA DE MALVINAS CON SECUELAS DE DISCAPACIDAD;CD;L ;PJ;14/01/2003
;http://www.hcdmza.gov.ar/proy/viewer.php?nro=32432;32432;AHUMADA,ARTURO;   ;SOLICITANDO AL SUBSEC. DE TURISMO CONCURRA A COMISION DE TURA FIN DE INFORMAR SOBRE LA VENDIMIA GAY;CD;R ;PJ;04/02/2003
;http://www.hcdmza.gov.ar/proy/viewer.php?nro=32635;32635;AHUMADA,ARTURO;   ;SOLICITANDO FISCAL ESTADO INFORME SOBRE EL RESULTADO DE LASINVESTIGACIONES QUE SURGIERON DEL EXPTE. 1178-H-01, RESPECTOA LA NO APLICACION DE LA LEY IMPOSITIVA NRO. 6865.;CD;R ;PJ;04/03/2003
;http://www.hcdmza.gov.ar/proy/viewer.php?nro=32636;32636;AHUMADA,ARTURO;   ;SOLICITANDO PE INFORME EL RESULTADO DE APLICACION DE LA LEY6865 -LEY IMPOSITIVA-;CD;R ;PJ;04/03/2003
;http://www.hcdmza.gov.ar/proy/viewer.php?nro=32648;32648;AHUMADA,ARTURO;   ;SOLICITANDO PE INFORME SOBRE ACUERDO REALIZADOS CON LASEMPRESAS QUE EXTRAEN PETROLEO EN EL TERRITORIO PROVINCIALPOR DEUDAS DEVENGADAS POR EL IMPUESTO DE SELLOS;CD;R ;PJ;05/03/2003
;http://www.hcdmza.gov.ar/proy/viewer.php?nro=32649;32649;AHUMADA,ARTURO;   ;SOLICITANDO PE INFORME SOBRE LA EVOLUCION DE LA DEUDAFLOTANTE DESDE SETIEMBRE 2002 A AL FECHA;CD;R ;PJ;06/03/2003
;http://www.hcdmza.gov.ar/proy/viewer.php?nro=32697;32697;AHUMADA,ARTURO;   ;SOLICITANDO PE PRORROGUE POR 15 DIAS EL VENCIMIENTO DEL PAGODEL IMPUESTO A LOS AUTOMOTORES;CD;R ;PJ;12/03/2003
;http://www.hcdmza.gov.ar/proy/viewer.php?nro=32751;32751;AHUMADA,ARTURO;   ;DECLARANDO INTERES H. CAMARA EL PROYECTO PRESENTADO POR LOSASTRONOMOS MENDOCINOS (GAMA) PARA LA CREACION DEL PARQUEASTRONOMICO;CD;D ;PJ;18/03/2003
;http://www.hcdmza.gov.ar/proy/viewer.php?nro=32841;32841;AHUMADA,ARTURO;   ;ADHIRIENDO AL TRATAMIENTO FAVORABLE DEL PROYECTO DE LEY OBRANTE EN EXPTE. 978-D-03 SOBRE CONSORCIOS PRODUCTIVOS PRESENTADO POR DIPUTADOS NACIONALES POR MENDOZA;CD;R ;PJ;28/03/2003
;http://www.hcdmza.gov.ar/proy/viewer.php?nro=32867;32867;AHUMADA,ARTURO;CIURCA   ;SOLICITANDO MIN.DES.SOC.SAL. INFORME SITUACION OPERATIVA YDEL PERSONAL DEL HOSPITAL USPALLATA;CD;R ;PJ;02/04/2003
;http://www.hcdmza.gov.ar/proy/viewer.php?nro=33039;33039;AHUMADA,ARTURO;CORDOBA   ;SOLICITANDO MIN.HAC. INFORME SOBRE LA EJECUCIONPRESUPUESTARIA DE LOS ANOS 2002 Y 2003;CD;R ;PJ;29/04/2003
;http://www.hcdmza.gov.ar/proy/viewer.php?nro=33050;33050;AHUMADA,ARTURO;   ;SOLICITANDO MIN.AMB.O.P. INFORME RESPECTO A LA ADJUDICACIONDE LOS CAMPAMENTOS DE EX-EMSE, DE AGUA DEL TORO, LOS REYUNOSY VALLE GRANDE;CD;R ;PJ;02/05/2003
;http://www.hcdmza.gov.ar/proy/viewer.php?nro=33049;33049;AHUMADA,ARTURO;   ;QUE EL I.P.V. EN LOS PROGRAMAS DE MEJORAMIENTO DE BARRIOS,PRIORIZARA LA OCUPACION DE MANO DE OBRA DEL LUGAR;CD;R ;PJ;02/05/2003
;http://www.hcdmza.gov.ar/proy/viewer.php?nro=33054;33054;AHUMADA,ARTURO;MORON   ;CITANDO SUB-DIRECTOR PROG. FINAN., CONT. TESORERIA GENERAL YJEFE UNIDAD EJECUTORA  A COMI. H.P. A FIN DE QUE INFORMENSOBRE EMBARGOS EN LAS CUENTAS PROVINCIALES;CD;R ;PJ;02/05/2003
;http://www.hcdmza.gov.ar/proy/viewer.php?nro=33051;33051;AHUMADA,ARTURO;   ;SOLICITANDO FISCAL ESTADO INFORME SOBRE ADJUDICACION DE LOSCAMPAMENTOS DE EX-EMSE, DE AGUA DEL TORO, LOS REYUNOS YVALLE GRANDE;CD;R ;PJ;02/05/2003
;http://www.hcdmza.gov.ar/proy/viewer.php?nro=33055;33055;AHUMADA,ARTURO;   ;SOLICITANDO PRONTO TRATAMIENTO DEL EXPTE. 32671;CD;R ;PJ;05/05/2003
;http://www.hcdmza.gov.ar/proy/viewer.php?nro=33176;33176;AHUMADA,ARTURO;CIURCA SERRALTA  ;CREANDO EL FONDO ESTABILIZADOR DE TARIFAS (FET);CD;L ;PJ;20/05/2003
;http://www.hcdmza.gov.ar/proy/viewer.php?nro=33205;33205;AHUMADA,ARTURO;HABJAN   ;INVITANDO AL MINIST. DE HACIENDA Y AL JEFE DEL DPTO. DE HIDROCARBUROS A COMISIONES DE LAB.PARLAM., ECONOMIA Y DE HP AFIN DE INFORMAR LOS RECURSOS PCIALES. COMO REGAL. PETROLIF.;CD;R ;PJ;22/05/2003
;http://www.hcdmza.gov.ar/proy/viewer.php?nro=33226;33226;AHUMADA,ARTURO;URIGUEN   ;FACULTANDO AL PE A DISPONER ADECUACIONES TARIFARIAS DE LOSSERVICIOS PUBLICOS CONCESIONADOS POR LEY 6976;CD;L ;PJ;27/05/2003
;http://www.hcdmza.gov.ar/proy/viewer.php?nro=33273;33273;AHUMADA,ARTURO;   ;DECLARANDO DE INTERES DE LA H. CAMARA LA VISITA DEL CONSULGRAL. DEL BRASIL, PAULO ALBERTO DA SILVEIRA SOARES;CD;R ;PJ;30/05/2003
;http://www.hcdmza.gov.ar/proy/viewer.php?nro=33304;33304;AHUMADA,ARTURO;URIGUEN   ;FACULTANDO PE ELABORE UN ACTA ACUERDO PARA LA CREACION DE LAFACULTAD DE CIENCIAS VETERINARIAS POR PARTE DE LA U.N.C.;CD;L ;PJ;03/06/2003
;http://www.hcdmza.gov.ar/proy/viewer.php?nro=33303;33303;AHUMADA,ARTURO;   ;ESTABLECIENDO EL REGIMEN DE LA PROFILAXIS DE LA ENCEFALITISRABICA;CD;L ;PJ;03/06/2003
;http://www.hcdmza.gov.ar/proy/viewer.php?nro=33374;33374;AHUMADA,ARTURO;   ;QUE EL PE INCLUYERA LA CONSTRUCCION DE UN CENTRO DE SALUD YDE NUEVO EDIFICIO PARA LA ESCUELA 1-093 "CERVANTES" DE JOCOLI VIEJO, LAVALLE;CD;D ;PJ;11/06/2003
;http://www.hcdmza.gov.ar/proy/viewer.php?nro=33418;33418;AHUMADA,ARTURO;SERRALTA   ;ENCOMENDANDO COM. L.P. COLABORAR EN LA CONCILIACION DE LOSINTERESES DE LOS MAGISTRADOS DEL P.JUDICIAL Y EL PODEREJECUTIVO, PARA SOLUCIONAR LA PROBLEMATICA;CD;R ;PJ;18/06/2003
;http://www.hcdmza.gov.ar/proy/viewer.php?nro=33422;33422;AHUMADA,ARTURO;SUAREZ PARISI  ;DECLARANDO EN SITUACION DE EMERGENCIA CLIMATICA AL DEPTO.SAN CARLOS;CD;L ;PJ;18/06/2003
;http://www.hcdmza.gov.ar/proy/viewer.php?nro=33461;33461;AHUMADA,ARTURO;   ;SOLICITANDO MIN.JUS.SEG. REMITA ESTADISTICA POLICIALES,DELITOS CONTRA LAS PERSONAS, DELITOS CONTRA LA PROPIEDADOCURRIDOS ENTRE EL 01-01-03 AL 31-05-03;CD;R ;PJ;24/06/2003
;http://www.hcdmza.gov.ar/proy/viewer.php?nro=33518;33518;AHUMADA,ARTURO;   ;DECLARANDO DE INTERES DE LA H. CAMARA LAS MUESTRAS DE ARTESPLASTICAS "PECADOS CAPITALES" Y "EL ZODIACO DE AMERICA A LAINDIA";CD;R ;PJ;30/06/2003
;http://www.hcdmza.gov.ar/proy/viewer.php?nro=33517;33517;AHUMADA,ARTURO;   ;QUE EL PE DECLARARA DE INTERES PCIAL. LAS MUESTRAS DE ARTESPLASTICAS "PECADOS CAPITALES" Y "EL ZODIACO DE AMERICA A LAINDIA";CD;D ;PJ;30/06/2003
;http://www.hcdmza.gov.ar/proy/viewer.php?nro=33652;33652;AHUMADA,ARTURO;GARRO   ;DECLARANDO EXIMIDO DEL PAGO DE EFECTIVO DE TODOS LOSIMPUESTOS PROVINCIALES Y DE SERVICIOS PUBLICOS, A LOSCLUBES O ENTIDADES SOCIALES Y DEPORTIVAS SIN FINES DE LUCRO;CD;L ;PJ;21/07/2003
;http://www.hcdmza.gov.ar/proy/viewer.php?nro=33714;33714;AHUMADA,ARTURO;   ;SOLICITANDO PE REMITA COPIA DE LOS EXPTES DE TODOS LOSDEUDORES DE IMPUESTOS PROVINCIALES QUE HAYAN CANCELADO SUSOBLIGACIONES CON BONOS ACONCAGUA, RES. 30/03;CD;R ;PJ;30/07/2003
;http://www.hcdmza.gov.ar/proy/viewer.php?nro=33743;33743;AHUMADA,ARTURO;   ;QUE EL PE APOYARA CONFORME A LAS PAUTAS PRESUPUESTARIAS DEL 2003 A LA COOP. DE NUTRICION INFANTIL "FUNDACION CONIN";CD;D ;PJ;05/08/2003
;http://www.hcdmza.gov.ar/proy/viewer.php?nro=33814;33814;AHUMADA,ARTURO;   ;INVITANDO AL ADMINISTRADOR DE PARQUES Y ZOOLOGICOS A LA COMISION D.G.C.P.P. A FIN DE QUE INFORME SOBRE LA HABILITACION OTORGADA A UN "PUB" EN LAS INSTALACIONES DEL CLUB INDEPENDIENTE RIVADAVIA

;CD;R ;PJ;18/08/2003
;http://www.hcdmza.gov.ar/proy/viewer.php?nro=33819;33819;AHUMADA,ARTURO;   ;INVITANDO SECRETARIO DE GOBIERNO DE LA MUNICIPALIDAD DE CAPITAL A LA COMISION DE D.G.C.P.P. A FIN DE QUE INFORME SOBRE LA HABILITACION OTORGADA A UN "PUB" EN LAS INSTALACIONES DEL CLUB INDEPENDIENTE RIVADAVIA;CD;R ;PJ;19/08/2003
;http://www.hcdmza.gov.ar/proy/viewer.php?nro=33818;33818;AHUMADA,ARTURO;   ;SOLICITANDO AL PE QUE ATRAVES DE LA DCCION. GRAL DE ESCUELAS INFORME SOBRE LOS MOTIVOS DE LA NO HABILITACION DE CURSOS DE PRE GRADOS EN LA ESCUELA ITALIANA;CD;R ;PJ;19/08/2003
;http://www.hcdmza.gov.ar/proy/viewer.php?nro=33877;33877;AHUMADA,ARTURO;   ;INVITANDO AL MINSITRO DE JUSTICIA Y SEGURIDAD, A LOS CENTROS TRADICIONALISTAS, AL SINDICATO DE LA CARNE Y A LAS ENTIDADES DE LOS SECTORE DE LA PRODUCC. AGRICOLA Y GANDERA A LA COMISION DE LAC A FIN DE ANALIZAR LA INSEGURIDAD DE LA ZONA RURAL;CD;R ;PJ;26/08/2003
;http://www.hcdmza.gov.ar/proy/viewer.php?nro=33889;33889;AHUMADA,ARTURO;CIURCA   ;ESTABLECIENDO UNA LEY MARCO DE USO DEL SUELO Y SUBDIVISION DE LA TIERRA;CD;L ;PJ;27/08/2003
;http://www.hcdmza.gov.ar/proy/viewer.php?nro=33922;33922;AHUMADA,ARTURO;   ;INVITANDO AL MINISTRO DE ECONOMIA A FIN DE TRATAR EL PROYECTO DE LEY CREANDO AL FACULTAD DE VETERINARIA EN SAN RAFAEL;CD;R ;PJ;29/08/2003
;http://www.hcdmza.gov.ar/proy/viewer.php?nro=33959;33959;AHUMADA,ARTURO;   ;SOLICITANDO PE INFORME SOBRE PUNTOS RELACIONADOS CON EL DESCONGELAMIENTO DE LA ANTIGUEDAD DE LOS EMPLEADOS PUBLICOS Y EL POSTERIOR PAGO DE LA DEUDA ORIGINADA A PARTIR DEL A�O 1997 A LA FECHA;CD;R ;PJ;03/09/2003
;http://www.hcdmza.gov.ar/proy/viewer.php?nro=33972;33972;AHUMADA,ARTURO;   ;MODIFICANDO LAS LEYES 3799, 5908 Y 4416 -REGISTRO DE ANTECEDENTES Y APTITUD DE CONSTRUCTORES DE OBRAS PUBLICAS- (RACOP);CD;L ;PJ;04/09/2003
;http://www.hcdmza.gov.ar/proy/viewer.php?nro=34014;34014;AHUMADA,ARTURO;GIARRIZZO   ;SOLICITANDO PEN INFORME SOBRE LA LICITACION DEL SEGUNDO TRAMO DE LA AVENIDA DE ACCESO ESTE A LA CIUDAD DE MENDOZA;CD;R ;PJ;09/09/2003
;http://www.hcdmza.gov.ar/proy/viewer.php?nro=34025;34025;AHUMADA,ARTURO;GARRO   ;INVITANDO AL DIRECTOR DE RECURSOS NATURALES DE LA PCIA. A UNA REUNION DE LA COMISION DE AMBIENTE, URBANISMO Y VIVIENDA A FIN DE QUE INFORME SOBRE LA PODA DEL ARBOLADO FUERA DE TERMINOS;CD;R ;PJ;10/09/2003
;http://www.hcdmza.gov.ar/proy/viewer.php?nro=34116;34116;AHUMADA,ARTURO;   ;INVITANDO AL MINIST. DE ECONOMIA A LA COMISION DE DERECHOS Y GARANTIAS A FIN DE INFORMAR SOBRE LA ACTUACION DE LOS REPRESENTANTES DEL GOBIERNO PCIAL. LA LA RENOVACION DE AUTORIDADES EN LA FUNDACION INSTITUTO TECNOLOGICO UNIVERSITARIO;CD;R ;PJ;19/09/2003
;http://www.hcdmza.gov.ar/proy/viewer.php?nro=34176;34176;AHUMADA,ARTURO;   ;INVITANDO AL DIRECTOR DE HIDRAULICA DEL MINIST. DE AMBIENTE Y OP A FIN DE QUE INFORME SOBRE EL PERSONAL DE LA REPARTICION, EL EQUIPAMIENTO Y PROGRAMAS DE DESARROLLO;CD;R ;PJ;26/09/2003
;http://www.hcdmza.gov.ar/proy/viewer.php?nro=34194;34194;AHUMADA,ARTURO;DOMINGUEZ   ;CITANDO AL PRESIDENTE DEL INST. PCIAL. DE JUEGOS Y CASINOS PARA QUE INFORME SOBRE LA APLICACION DEL ART. 5 Y 6 DE LA LEY 7139 Y LOS RESPECTIVOS PLIEGOS DE LICITACION;CD;R ;PJ;29/09/2003
;http://www.hcdmza.gov.ar/proy/viewer.php?nro=34296;34296;AHUMADA,ARTURO;PARISI CIURCA  ;INVITANDO AL ADM.PARQUES Y ZOOLOGICOS A REUNION COMISION D.G.C.P.P. A FIN DE QUE INFORME SOBRE
SITUACION DEL PERSONAL EN CUANTO A REGIMEN LABORAL, DESPIDOS DE CONTRATOS, PREVISION DE HERRAMIENTAS Y ROPA DE TRABAJO;CD;R ;PJ;14/10/2003
;http://www.hcdmza.gov.ar/proy/viewer.php?nro=34354;34354;AHUMADA,ARTURO;   ;SOLICITANDO MIN.DES.SOC.SAL. INFORME SOBRE EL LLAMADO A LICITACION PARA LA ADQUISICION DE UN EQUIPO DE ESTERILIZACION POR PLASMA DE PEROXIDO DE HIDROGENO ENTRE OTROS TEMAS;CD;R ;PJ;21/10/2003
